<?xml version="1.0" encoding="utf-8" ?>
<entities xmlns:xsi="http://www.w3.org/2001/XMLSchema-instance" xsi:noNamespaceSchemaLocation="https://raw.githubusercontent.com/shopware/platform/trunk/src/Core/Framework/App/Entities/Schema/entity-1.0.xsd">
    <entity name="custom_entity_blog">
        <fields>
            <int name="position" store-api-aware="true" />
            <float name="rating" store-api-aware="true" />
            <string name="title" required="true" translatable="true" store-api-aware="true" />
            <text name="content" allow-html="true" translatable="true" store-api-aware="true" />
            <bool name="display" translatable="true" store-api-aware="true" />
            <json name="payload" store-api-aware="false" />
            <email name="email"  store-api-aware="false" />

            <price name="price" store-api-aware="false" />
            <date name="my_date" store-api-aware="false" />
        </fields>
    </entity>

    <entity name="ce_blog_comment">
        <fields>
            <string name="title" required="true" translatable="true" store-api-aware="true" />
            <!-- <fk name="ce_blog_comments_id" required="true"   <<< defined over the one-to-many association -->
            <text name="content" allow-html="true" translatable="true" store-api-aware="true" />
            <email name="email"  store-api-aware="false" />
            <many-to-one name="recommendation" reference="product" store-api-aware="true" required="false" on-delete="set-null" />
        </fields>
    </entity>
</entities>
